split,sentence_id,category_id,text,category,polarity
train,667,667::cat::0,Prices are in line.,price,neutral
train,1600,1600::cat::0,"The combination of fresh tomato sauce, fresh mozz cheese, basil and the dough they make with imported flour, makes this is one of the better pizza's in NY.",food,positive
train,134,134::cat::0,The food is prepared quickly and efficiently.,food,positive
train,3336,3336::cat::0,and for this i had to shell out a small fortune?,price,negative
train,2421,2421::cat::0,"For all of you new to Indian food, try the Paneer Roll, it is a piece of heaven.",food,positive
train,159,159::cat::0,The food looked very appetizing and delicious since it came on a variety of fancy plates.,food,positive
train,1490,1490::cat::0,Both the fresh mozzerella slices and the Plain Cheese slice are phenomenal.,food,positive
train,3546,3546::cat::0,I have tried literally every restaurant on curry row.,anecdotes/miscellaneous,neutral
train,1548,1548::cat::0,"The food is terrible and overall, I would have to say avoid at all costs.",food,negative
train,2107,2107::cat::0,"I've been to this monster sushi twice, the 46th st once, the 23rd st one a number of times.",anecdotes/miscellaneous,neutral
train,1709,1709::cat::0,"Unfortunately, the food was NOT something to get worked up about.",food,negative
train,1550,1550::cat::0,"It's constantly open, catering to the Pakistani cabbies lined up on Crosby St., so there's more turnover with the food than you'd expect (i.e., surprisingly fresh).",food,positive
train,1550,1550::cat::1,"It's constantly open, catering to the Pakistani cabbies lined up on Crosby St., so there's more turnover with the food than you'd expect (i.e., surprisingly fresh).",ambience,positive
train,3305,3305::cat::0,I had Filet Mignon with garlic mash.,food,neutral
train,874,874::cat::0,"I went at 6:00 PM specifically for the pre-theater menu ($19.95 for roasted tomato soup with chevre, steak frites, creme brulee) and it was marvelous.",food,positive
train,874,874::cat::1,"I went at 6:00 PM specifically for the pre-theater menu ($19.95 for roasted tomato soup with chevre, steak frites, creme brulee) and it was marvelous.",price,positive
train,3116,3116::cat::0,"The waitstaff were attentive, polite and helpful - an impressive feat in such close quarters.",service,positive
train,2707,2707::cat::0,Go inside and you won't want to leave.,anecdotes/miscellaneous,positive
train,2630,2630::cat::0,I loving bringing friends here - and I do so every chance I get.,anecdotes/miscellaneous,positive
train,3353,3353::cat::0,"- the bread at the beginning is super tasty and makes you want more - the pizza is delicious and comes in personal sizes, however be warned that the Peter's Favourite pizza with prosciutto and baby arugula is actually a margarite pizza with cold prosciutto and baby arugula on top, like a salad.",food,positive
train,2081,2081::cat::0,"Yes, the prices are high, but I felt it was worth it.",price,conflict
train,533,533::cat::0,"The large selection of bruschettas, paninis, tramezzinis keep the palate from stagnating.",food,positive
train,972,972::cat::0,"Have always found that the waiters will go out of their way to be helpful, despite the fact they are often busy with lots of diners.",service,positive
train,3420,3420::cat::0,"While this isn't classical restaurant fare, the chef has given new life to an old cuisine with some really innovative and tasty dishes that are genuinely Indian without being heavy or same old restaurant burn-outs.",food,positive
train,2329,2329::cat::0,The owner truly caters to all your needs.,service,positive
train,1827,1827::cat::0,He takes real pride in his food and his business.,service,positive
train,1827,1827::cat::1,He takes real pride in his food and his business.,food,positive
train,692,692::cat::0,Every time in New York I make it a point to visit Restaurant Saul on Smith Street.,anecdotes/miscellaneous,positive
train,217,217::cat::0,My boyfriend and I went there to celebrate my birthday the other night and all I can say is that it was magnificent.,anecdotes/miscellaneous,positive
train,878,878::cat::0,"So if you want a nice, enjoyable meal at Montparnasse, go early for the pre-theater prix-fixe.",food,positive
train,878,878::cat::1,"So if you want a nice, enjoyable meal at Montparnasse, go early for the pre-theater prix-fixe.",price,positive
train,2891,2891::cat::0,"Over the years, it has always provided a pleasurable dining experience with quality food and wine.",food,positive
train,2673,2673::cat::0,I would go back tho.,anecdotes/miscellaneous,positive
train,2276,2276::cat::0,"The photobook menu was a cute touch, certainly helped my group and I pick the fried chicken, pork chop, and noodle dishes that we all ordered.",food,positive
train,3199,3199::cat::0,too large for just two people but nothing was left.,food,positive
train,3414,3414::cat::0,I cannot imagine better Indian food in all of the city.,food,positive
train,209,209::cat::0,Great romantic place for a date (try to get the corner booth table for a little privacy and to sit close!).,ambience,positive
train,3077,3077::cat::0,A pleasant surprise.,anecdotes/miscellaneous,positive
train,1228,1228::cat::0,I asked for an open faced cheese sandwich and the manager basically told me to take my business elsewhere!,service,negative
train,3297,3297::cat::0,If you don't mind all that noise then go to the Chart House.,ambience,conflict
train,1759,1759::cat::0,We got most of it back at home with us.,anecdotes/miscellaneous,neutral
train,2966,2966::cat::0,Get there before 7pm.,anecdotes/miscellaneous,neutral
train,2077,2077::cat::0,very good breads as well.,food,positive
train,3554,3554::cat::0,"if this happens, just ask for real naan.",anecdotes/miscellaneous,neutral
train,410,410::cat::0,We were fans of the half-price Saturday night option until some inedible squid during a recent visit.,food,negative
train,410,410::cat::1,We were fans of the half-price Saturday night option until some inedible squid during a recent visit.,price,positive
train,202,202::cat::0,"So, if yo really don't care who is sittingnext to you, which is about 2 inches away, I would say try it.",ambience,conflict
train,3492,3492::cat::0,"Pizza is terrific, as is homemade pasta.",food,positive
train,537,537::cat::0,Definitely a neighborhood favorite.,anecdotes/miscellaneous,positive
train,2439,2439::cat::0,This is a wonderful place on all stand points especially value ofr money.,price,positive
train,3562,3562::cat::0,My first encounter happened one friday evening with a friend.,anecdotes/miscellaneous,neutral
train,3280,3280::cat::0,Example is the soup which was about 6 oz for $12 dollars and the mushrooms where $12 for about 1oz.,price,positive
train,2189,2189::cat::0,"Service is not exactly five star, but thats not really a big deal.",service,conflict
train,3573,3573::cat::0,There are other people waiting!,service,neutral
train,277,277::cat::0,"From beginning appetizers, the scallops were incredible, to the delicious chocolate souffle with rasberry mint sorbet, we were delighted by the taste sensations.",food,positive
train,2460,2460::cat::0,OU MUST TRY THIS RESTAURANT.,anecdotes/miscellaneous,positive
train,952,952::cat::0,"We left, never to return.",anecdotes/miscellaneous,negative
train,2811,2811::cat::0,Consistently good Japanese Tapas.,food,positive
train,2024,2024::cat::0,No apologies during restaurant week.,anecdotes/miscellaneous,negative
train,3020,3020::cat::0,"My goodness, everything from the fish to the rice to the seaweed was absolutely amazing.",food,positive
train,3079,3079::cat::0,"This place started off a little iffy, but is now one of my favorite indian restaurants in NYC (and I'm indian, so I should know).",anecdotes/miscellaneous,conflict
train,2716,2716::cat::0,They also do a great job for restaurant week.,anecdotes/miscellaneous,positive
train,746,746::cat::0,I went to this restaurant with a woman that I met recently.,anecdotes/miscellaneous,neutral
train,2912,2912::cat::0,"The dishes offered were unique, very tasty and fresh from the lamb sausages, sardines with biscuits, large whole shrimp to the amazing pistachio ice cream (the best and freshest I've ever had).",food,positive
train,3566,3566::cat::0,This is where the aforementioned line was.,anecdotes/miscellaneous,neutral
train,1702,1702::cat::0,The food is reliable and the price is moderate.,food,positive
train,1702,1702::cat::1,The food is reliable and the price is moderate.,price,neutral
train,199,199::cat::0,"Aside from the bearded, courdoroy blazer professor type with the NYU student he's sleeping with that week, you see a strange mix of hipsters, frat boys, Will Smith types who need to be told they are black, bitter cougars who cant understand why they arent married yet....",ambience,neutral
train,882,882::cat::0,"While the ambiance and atmosphere were great, the food and service could have been a lot better.",food,negative
train,882,882::cat::1,"While the ambiance and atmosphere were great, the food and service could have been a lot better.",service,negative
train,882,882::cat::2,"While the ambiance and atmosphere were great, the food and service could have been a lot better.",ambience,positive
train,2324,2324::cat::0,We always go there on the weekends and leave extremely full and satisfied.,anecdotes/miscellaneous,positive
train,2524,2524::cat::0,i dont how this place is still running.,anecdotes/miscellaneous,negative
train,628,628::cat::0,The server was really cool and served us our food and drinks with a smile.,service,positive
train,3563,3563::cat::0,We were in search of food and stumbled on this block of Indian restaurants on East Sixth Street.,anecdotes/miscellaneous,neutral
train,727,727::cat::0,"Planet Thailand has always been a hit with me , I go there usually for the sushi, which is great , the thai food is excellent too .",food,positive
train,1925,1925::cat::0,"Very excited to hear that short-term Chef Jason Narone has moved on, he truly was a low point of their Sterling track record.",anecdotes/miscellaneous,negative
train,2740,2740::cat::0,Excellent experience.,anecdotes/miscellaneous,positive
train,3422,3422::cat::0,"Well worth the trip, close to City Hall and downtown subway stops.",anecdotes/miscellaneous,positive
train,3144,3144::cat::0,I had to share my table with a loud group of kids and the service was rude an unattentive.,service,negative
train,3144,3144::cat::1,I had to share my table with a loud group of kids and the service was rude an unattentive.,ambience,negative
train,2202,2202::cat::0,What more could you want?,anecdotes/miscellaneous,positive
train,618,618::cat::0,"If you are the type of person who likes being scared and entertained, this is a great place to go and eat.",anecdotes/miscellaneous,positive
train,1919,1919::cat::0,"All in all, I don't see how you can go wrong.",anecdotes/miscellaneous,positive
train,1487,1487::cat::0,The sauce on the pizza is sooo good with garlic and fresh tomatoes and they don't skimp.,food,positive
train,2120,2120::cat::0,"We recently decided to try this location, and to our delight, they have outdoor seating, perfect since I had my yorkie with me.",ambience,positive
train,1868,1868::cat::0,"My husband had the mesclun, salmon, and ice cream and he enjoyed all 3 courses.",food,positive
train,770,770::cat::0,We were told that the wait was about twenty minutes and there would be no problem for our 8:00 pm curtain call.,anecdotes/miscellaneous,neutral
train,2205,2205::cat::0,The food is usually good but it certainly isn't a relaxing place to go.,food,positive
train,2205,2205::cat::1,The food is usually good but it certainly isn't a relaxing place to go.,ambience,negative
train,948,948::cat::0,I'm told that it is open 24hrs which is good.,anecdotes/miscellaneous,positive
train,1940,1940::cat::0,"Super friendly and knowledgable staff, fabulous bistro fare and a wonderful jazz brunch with great live jazz (the chilaquiles were awesome!",food,positive
train,1940,1940::cat::1,"Super friendly and knowledgable staff, fabulous bistro fare and a wonderful jazz brunch with great live jazz (the chilaquiles were awesome!",service,positive
train,1940,1940::cat::2,"Super friendly and knowledgable staff, fabulous bistro fare and a wonderful jazz brunch with great live jazz (the chilaquiles were awesome!",ambience,positive
train,2451,2451::cat::0,The prices were fantastic.,price,positive
train,56,56::cat::0,What a great place!,anecdotes/miscellaneous,positive
train,1632,1632::cat::0,"Still, any quibbles about the bill were off-set by the pour-your-own measures of liquers which were courtesey of the house...",food,positive
train,1632,1632::cat::1,"Still, any quibbles about the bill were off-set by the pour-your-own measures of liquers which were courtesey of the house...",price,conflict
train,1961,1961::cat::0,"The table service could have been a little more attentive but as someone who also works in the service industry, I understood they were busy.",service,conflict
train,710,710::cat::0,"It's not mind-blowing, but to me, thai food never is and never will be.",food,neutral
train,911,911::cat::0,"Food was very good as well, considering that we tried the budget selection (though I wish the pork belly that I ordered was roasted a bit longer, so that fat was more of a melt-in-your-mouth experience).",food,conflict
train,3607,3607::cat::0,"Although, one night we went it was super cheesy, and another night it was less cheesy.",food,conflict
train,1955,1955::cat::0,"Even though it is a little loud, you don't have to yell at each other to talk.",ambience,conflict
train,2903,2903::cat::0,"i've been to sapphire twice and both times the food was fine, if not good.",food,positive
train,1887,1887::cat::0,It is kinda nosiy and the tables are close together but it's still a beautiful place to enjoy a nice dinner.,ambience,conflict
train,3495,3495::cat::0,Was surprisingly disappointed.,anecdotes/miscellaneous,negative
train,1273,1273::cat::0,I love the fact that the pizza tastes so good and is so cheap.,food,positive
train,1273,1273::cat::1,I love the fact that the pizza tastes so good and is so cheap.,price,positive
train,590,590::cat::0,Nicky the Nose at the bar is a treat.,service,positive
train,762,762::cat::0,I went to Ruby Foo's after work with a group of 6.,anecdotes/miscellaneous,neutral
train,3374,3374::cat::0,I'm amazed we haven't been kicked out of this place yet.,anecdotes/miscellaneous,neutral
train,179,179::cat::0,"Service was prompt, friendly and great.",service,positive
train,109,109::cat::0,"I haven't eat a lamb chop as delicious as that,the salads are really nice dressed with lemon and extra virgnin olive oil.",food,positive
train,339,339::cat::0,The sushi was awful!,food,negative
train,489,489::cat::0,Katz's has been a NYC original for over 100 years.,anecdotes/miscellaneous,positive
train,2487,2487::cat::0,You can get an excellent meal at most of the many Indian restaurants on nearby Lexington Avenue for the cost of one the dainty dishes here.,price,negative
train,499,499::cat::0,"The Pastrami sandwich was like buttah and with pickles and an icy cold beer to wash it down, it was a pleasurable experience.",food,positive
train,2589,2589::cat::0,The plain pizza was soggy and the creative wild mushroom(third generation-Fornini) pizza we had was drenched with truffle oil in the middle( again making it soggy) and nothingon the rest.,food,negative
train,3701,3701::cat::0,"Late nite omelletes are not good here, there is no variety!",food,negative
train,381,381::cat::0,Everything at Sala Thai is tasty and well-portioned.,food,positive
train,3050,3050::cat::0,"After all that, they complained to me about the small tip.",service,negative
train,1185,1185::cat::0,It's a great place to pick up a cheap lunch or dinner.,price,positive
train,1555,1555::cat::0,"Behind this counter, two men are squeezed in.",ambience,negative
train,1112,1112::cat::0,Great find!!!,anecdotes/miscellaneous,positive
train,3368,3368::cat::0,"If only they delivered, they'd make a mint!",anecdotes/miscellaneous,positive
train,1032,1032::cat::0,"Whenever you need a Sushi fix, Mizu will be there with quality fish and great service.",food,positive
train,1032,1032::cat::1,"Whenever you need a Sushi fix, Mizu will be there with quality fish and great service.",service,positive
train,1124,1124::cat::0,"Our waitress was sweet and accomodating, not overbearing.",service,positive
train,1663,1663::cat::0,Went there with my wife and we had to wait for a table even though you could see there many that were empty with not reservation sigh on them.,service,negative
train,1690,1690::cat::0,I was really disappointed ant wanted to tell everyone not to go eat or even take out food from there.,anecdotes/miscellaneous,negative
train,788,788::cat::0,The website and rating makes this place look wonderful but in reality it was very disappointing.,ambience,conflict
train,788,788::cat::1,The website and rating makes this place look wonderful but in reality it was very disappointing.,anecdotes/miscellaneous,conflict
train,1780,1780::cat::0,"Despite a slightly limited menu, everything prepared is done to perfection, ultra fresh and a work of food art.",food,conflict
train,742,742::cat::0,The outdoor atmosphere of sitting on the sidewalk watching the world go by 50 feet away on 6th avenue on a cool evening was wonderful.,ambience,positive
train,1471,1471::cat::0,"A large is $20, and toppings are about $3 each.",price,negative
train,1789,1789::cat::0,"In any event, this is a place I'll be sure to stop by again when I'm in this part of town.",anecdotes/miscellaneous,positive
train,2751,2751::cat::0,I definitely wouldn't go back.,anecdotes/miscellaneous,negative
train,1189,1189::cat::0,It is not worth for that bucks.,price,negative
train,3352,3352::cat::0,brick oven gallery is My pick for best pizza restaurant anywhere.,anecdotes/miscellaneous,positive
train,3315,3315::cat::0,Add to that great service and great food at a reasonable price and you have yourself the beginning of a great evening.,food,positive
train,3315,3315::cat::1,Add to that great service and great food at a reasonable price and you have yourself the beginning of a great evening.,price,positive
train,3315,3315::cat::2,Add to that great service and great food at a reasonable price and you have yourself the beginning of a great evening.,service,positive
train,3393,3393::cat::0,"For many people, this may not seem like Aunthentic Thai food because most places in NYC arent quite authentic.",food,negative
train,2157,2157::cat::0,"Growing up in NY, I have eaten my share of bagels.",anecdotes/miscellaneous,neutral
train,3018,3018::cat::0,"Oh, don't even let me start with how expensive the bills were!",price,negative
train,1401,1401::cat::0,A hearty two thumbs up!,anecdotes/miscellaneous,positive
train,257,257::cat::0,The scallion pancakes and fried dumplings were nothing out of the ordinary.,food,neutral
train,813,813::cat::0,"All the appetizers and salads were fabulous, the steak was mouth watering and the pasta was delicious!!!",food,positive
train,2862,2862::cat::0,"Besides having the table we had been promised given to other restaurant patrons twice before we were actually seated, we were served dishes we hadn't ordered three times, received one of our orders 20 minutes after the rest of the table had been served (and that order was undercooked), and charged $45 more than we should have been on our bill.",service,negative
train,2862,2862::cat::1,"Besides having the table we had been promised given to other restaurant patrons twice before we were actually seated, we were served dishes we hadn't ordered three times, received one of our orders 20 minutes after the rest of the table had been served (and that order was undercooked), and charged $45 more than we should have been on our bill.",price,negative
train,3292,3292::cat::0,Service is top notch.,service,positive
train,3343,3343::cat::0,The food now is inconsistent.,food,negative
train,3045,3045::cat::0,All pretty good.,anecdotes/miscellaneous,positive
train,3135,3135::cat::0,"You can also special order any kind of dumpling,etc.",anecdotes/miscellaneous,positive
train,3391,3391::cat::0,you guys rock.,anecdotes/miscellaneous,positive
train,3651,3651::cat::0,Chance is a joke.,anecdotes/miscellaneous,negative
train,2018,2018::cat::0,I was pretty much full after our fondue appetizer.,food,positive
train,2018,2018::cat::1,I was pretty much full after our fondue appetizer.,anecdotes/miscellaneous,positive
train,3551,3551::cat::0,BE CAREFUL before you request extra spice.,food,neutral
train,2355,2355::cat::0,The octopus eaters were floored by the Octopus salad.,food,positive
train,3178,3178::cat::0,We thought that this place is using too much of MSG cooking in the foods.,food,negative
train,586,586::cat::0,I was at Rao's last Wed.,anecdotes/miscellaneous,neutral
train,2211,2211::cat::0,And the Tom Kha soup was pathetic.,food,negative
train,2317,2317::cat::0,I started out with a Bombay beer which was big enough for two.,food,positive
train,175,175::cat::0,"The decor is vibrant and eye-pleasing with several semi-private boths on the right side of the dining hall, which are great for a date.",ambience,positive
train,1609,1609::cat::0,Service was quick.,service,positive
train,2706,2706::cat::0,Tends to turn people away.,anecdotes/miscellaneous,negative
train,1860,1860::cat::0,We thought this a prelude to what the evening will be like.,anecdotes/miscellaneous,neutral
train,961,961::cat::0,"I was turned on to this restaurant by a fellow foodie friend of mine, and have been going back regularly ever since.",anecdotes/miscellaneous,positive
train,1057,1057::cat::0,Drawbacks: service is slow and they don't toast!,service,negative
train,3188,3188::cat::0,Went there for an office lunch.,anecdotes/miscellaneous,neutral
train,65,65::cat::0,I have been doing all of the above at the Heartland Brewery for over 5 years now and I HAVE NEVER BEEN DISAPPOINTED!,anecdotes/miscellaneous,positive
train,2735,2735::cat::0,"Everytime I decide to try another place on the UES, I get angry that I didn't just go to Zucchero Pomodori.",anecdotes/miscellaneous,conflict
train,2882,2882::cat::0,The sweet lassi was excellent as was the lamb chettinad and the garlic naan but the rasamalai was forgettable.,food,conflict
train,1948,1948::cat::0,"We've been following chef Lyle's food around New York for 15 years and while remaining classic, his innovations with bistro fare have made us return and return.",food,positive
train,2041,2041::cat::0,The best thing I tasted were the lambchops.,food,positive
train,1046,1046::cat::0,it's delicious!,food,positive
train,1656,1656::cat::0,The spicy tuna and salmon are the best we've ever had.,food,positive
train,3440,3440::cat::0,"Even though its good seafood, the prices are too high.",food,positive
train,3440,3440::cat::1,"Even though its good seafood, the prices are too high.",price,negative
train,870,870::cat::0,"In addition, the food is very good and the prices are reasonable.",food,positive
train,870,870::cat::1,"In addition, the food is very good and the prices are reasonable.",price,positive
train,2986,2986::cat::0,"Upon entering, we were greeted by the owners, Steven and Frederick, who went out of their way to be more than gracious hosts.",service,positive
train,288,288::cat::0,"If you live outside the neighborhood, don't bother!",anecdotes/miscellaneous,negative
train,284,284::cat::0,Been going here since it opened have seen the quality value decrease considerably.,anecdotes/miscellaneous,negative
train,3418,3418::cat::0,"Meat dishes now adorn the selections, although there's still a large number of vegetarian-friendly choices.",food,neutral
train,3358,3358::cat::0,I never had anything I didn't like here.,anecdotes/miscellaneous,positive
train,83,83::cat::0,Reasonable prices.,price,positive
train,2940,2940::cat::0,they bring service up a notch by offerng complementary amuse bouche to all tables and gave us a small dessert for our celebration.,service,positive
train,2141,2141::cat::0,"Try the crunchy tuna, it is to die for.",food,positive
train,1854,1854::cat::0,It won't break the bank but I also wouldnt come back for the food.,food,negative
train,1854,1854::cat::1,It won't break the bank but I also wouldnt come back for the food.,price,conflict
train,396,396::cat::0,"All in all, this midtown gem instantly became one of my favorite sushi restaurants in the city.",anecdotes/miscellaneous,positive
train,3471,3471::cat::0,I've been to Joya twice and I will never go again.,anecdotes/miscellaneous,negative
train,3577,3577::cat::0,So rushing us out was absolutely unnecessary!,anecdotes/miscellaneous,negative
train,2283,2283::cat::0,However it is the ONLY Taiwanese restaurant in town.,anecdotes/miscellaneous,neutral
train,614,614::cat::0,It is a lot of fun with live entertainment and all kinds of Disney type special effects.,ambience,positive
train,3012,3012::cat::0,"if you're looking for perfect traditional sushi, go here - if you're looking for interesting combinations, try sushi of gari's (east side).",food,positive
train,2621,2621::cat::0,"No refills on fountain drinks, though.",food,negative
train,605,605::cat::0,Wow over 100 beers to choose from.,food,positive
train,2017,2017::cat::0,Be careful of portions - they're HUGE.,food,positive
train,2974,2974::cat::0,"The Steak Tartare is a great bet, they fix it for you at the table.",food,positive
train,2456,2456::cat::0,My first time there I happened not to like the Crab Croquette apt that i ordered and they were happy to change it for me without making no big deal.,service,positive
train,2456,2456::cat::1,My first time there I happened not to like the Crab Croquette apt that i ordered and they were happy to change it for me without making no big deal.,food,negative
train,25,25::cat::0,Great for large groups and celebrations - our SUPER HAPPY waiter was the entertainment of the evening.,service,positive
