split,sentence_id,category_id,text,category,polarity
train,1140,1140::cat::0,"Anyways, if you're in the neighborhood to eat good food, I wouldn't waste my time trying to find something, rather go across the street to Tamari.",food,negative
train,2337,2337::cat::0,Dahkin also offers prix fixe lunch and buffet.,food,neutral
train,1174,1174::cat::0,"Although the place could be a little more eye catching and roomier, at the same time, it doesn't really matter.",ambience,conflict
train,3474,3474::cat::0,You can barely see who you are with never mind have a conversation.,ambience,negative
train,2818,2818::cat::0,This was my frist time at Cafe St. Bart's and I must say how delicous the food and the service was.,food,positive
train,2818,2818::cat::1,This was my frist time at Cafe St. Bart's and I must say how delicous the food and the service was.,service,positive
train,2920,2920::cat::0,I don't get it either.,anecdotes/miscellaneous,negative
train,162,162::cat::0,Went on a double date with friend and his girlfriend for a few drinks and appetizers.,anecdotes/miscellaneous,neutral
train,1216,1216::cat::0,Great place to grab a hot bagel on the way to work.,food,positive
train,3530,3530::cat::0,"It's like they took leftover chicken, poured oil and sprinkled pepper powder over it (the sauce was translucent and red).",food,negative
train,951,951::cat::0,"One would think we'd get an apology or complimentary drinks - instead, we got a snobby waiter wouldn't even take our order for 15 minutes and gave us lip when we asked him to do so.",service,negative
train,1005,1005::cat::0,One of my favorite places in Manhattan.,anecdotes/miscellaneous,positive
train,1619,1619::cat::0,"They brought glasses and the bottle, and just left the bottle at our table.",service,negative
train,1304,1304::cat::0,"We actually gave 10% tip (which we have never done despite mediocre food and service), because we felt totally ripped off.",food,neutral
train,1304,1304::cat::1,"We actually gave 10% tip (which we have never done despite mediocre food and service), because we felt totally ripped off.",service,neutral
train,1304,1304::cat::2,"We actually gave 10% tip (which we have never done despite mediocre food and service), because we felt totally ripped off.",price,negative
train,1856,1856::cat::0,We were looking forward to nice glass of Sangria when we arrived.,food,positive
train,3318,3318::cat::0,I would highly recommand requesting a table by the window.,anecdotes/miscellaneous,positive
train,1335,1335::cat::0,"While we enjoyed the food, we were highly disappointed by the poor service (waiter was not quite competent and SLOW service) and lack of remorse.",food,positive
train,1335,1335::cat::1,"While we enjoyed the food, we were highly disappointed by the poor service (waiter was not quite competent and SLOW service) and lack of remorse.",service,negative
train,2545,2545::cat::0,I for one will never patronize them again.,anecdotes/miscellaneous,negative
train,1821,1821::cat::0,I stumbled upon this great pizzeria as I explored my new neighborhood.,anecdotes/miscellaneous,positive
train,880,880::cat::0,"After hearing a lot of great things about the restaurant, and passing by it on a daily basis, we decided to try.",anecdotes/miscellaneous,neutral
train,401,401::cat::0,"The service, however, was a bright flower in a garden.",service,positive
train,1238,1238::cat::0,"So, again, give it a try.",anecdotes/miscellaneous,positive
train,889,889::cat::0,Stay far away from this place.,anecdotes/miscellaneous,negative
train,21,21::cat::0,We will come back!!!,anecdotes/miscellaneous,positive
train,2944,2944::cat::0,We've been to Grocery three times and not once has an item on the menu disappointed.,food,positive
train,3298,3298::cat::0,"The food is very good too but for the most part, it's just regular food, nothing special.",food,conflict
train,1344,1344::cat::0,A touch more jalapeno heat for contrast and it would have been very good indeed.,food,positive
train,1381,1381::cat::0,Tried the pad see ew on the recommendation of the last reviewer since it's one of my favorite dishes.,food,neutral
train,581,581::cat::0,We'd go back again,anecdotes/miscellaneous,positive
train,3658,3658::cat::0,"We ate out in the back patio, which is worth it as it's cool and the music is hear well there.",ambience,positive
train,1840,1840::cat::0,The location is perfect.,ambience,positive
train,2702,2702::cat::0,"Guacamole+shrimp appetizer was really great, we both had the filet, very good, didn't much like the frites that came with, but the filet was so good, neither of us cared.",food,conflict
train,3536,3536::cat::0,The lunch special is an asbolute steal.,price,positive
train,1363,1363::cat::0,This food is asian-air fusion.,food,neutral
train,1065,1065::cat::0,Nothing fancy but really good food with pretty reasonable price.,food,positive
train,1065,1065::cat::1,Nothing fancy but really good food with pretty reasonable price.,price,positive
train,2137,2137::cat::0,"The chicken pot pie is excpetiona, the cheeseburger huge and delictable, and the service professional wan warm.",food,positive
train,2137,2137::cat::1,"The chicken pot pie is excpetiona, the cheeseburger huge and delictable, and the service professional wan warm.",service,positive
train,2884,2884::cat::0,"While I quite liked the food and the ambience, I'm not quite sure if it they really deserve it the Michelin rating they have displayed so prooudly in the window.",food,conflict
train,2884,2884::cat::1,"While I quite liked the food and the ambience, I'm not quite sure if it they really deserve it the Michelin rating they have displayed so prooudly in the window.",ambience,conflict
train,2075,2075::cat::0,i'm surprised about some of the bad reviews posted here - i've been to tamarind about 5 or 6 times and always come away extremely satisfied and looking forward to returning.,anecdotes/miscellaneous,positive
train,3238,3238::cat::0,"But on a lazy Saturday night, we ended up going.",anecdotes/miscellaneous,neutral
train,558,558::cat::0,There are a few Italian employees who may not speak the best English but for me that adds to the experience.,service,conflict
train,3597,3597::cat::0,"I have never eaten in the restaurant, however, upon reading the reviews I got take out last week.",anecdotes/miscellaneous,neutral
train,1099,1099::cat::0,Once for dinner and once for brunch.,anecdotes/miscellaneous,neutral
train,169,169::cat::0,"I've been to at Cafe Spice probably 5-8 times, it is probably still the best Indian restaurant around Union Square.",anecdotes/miscellaneous,positive
train,2042,2042::cat::0,Not worth the prices.,price,negative
train,1603,1603::cat::0,Would recommend - perfect for those looking for a place close to grand central.,anecdotes/miscellaneous,positive
train,1114,1114::cat::0,From the moment you enter till the moment you walk out the friendly and helpful staff was was just Fantastic.,service,positive
train,233,233::cat::0,Service was good and food is wonderful.,food,positive
train,233,233::cat::1,Service was good and food is wonderful.,service,positive
train,1832,1832::cat::0,I only have friends.,anecdotes/miscellaneous,neutral
train,3276,3276::cat::0,She gets 10 for her excellent service and advice.,service,positive
train,960,960::cat::0,The restaurant is a bit noisy but that is something that can be overlooked once you sit down and enjoy a great meal,ambience,conflict
train,960,960::cat::1,The restaurant is a bit noisy but that is something that can be overlooked once you sit down and enjoy a great meal,food,positive
train,3555,3555::cat::0,"being a fan of spicy ethnic foods, indian included, i made friends with this place long ago.",food,positive
train,2863,2863::cat::0,Please save yourself the frustration.,anecdotes/miscellaneous,negative
train,2477,2477::cat::0,And I say snacking because it really is not set up to be a proper dinner.,ambience,conflict
train,1095,1095::cat::0,The quality of food at this restaurant accompanied by fantastic live jazz makes this place a perfect 10!,food,positive
train,1095,1095::cat::1,The quality of food at this restaurant accompanied by fantastic live jazz makes this place a perfect 10!,ambience,positive
train,696,696::cat::0,"I have eaten at Saul, many times, the food is always consistently, outrageously good.",food,positive
train,696,696::cat::1,"I have eaten at Saul, many times, the food is always consistently, outrageously good.",anecdotes/miscellaneous,neutral
train,62,62::cat::0,(Always ask the bartender for the SEASONAL beer!!!,food,positive
train,768,768::cat::0,"If your visiting, you'll enjoy the ambiance and the fact that it's in Time Sq...",ambience,positive
train,3636,3636::cat::0,"We were on our way back to NJ, and since I am in NY, we figured why not grab some food?",anecdotes/miscellaneous,neutral
train,3695,3695::cat::0,sandwiches tho pricey are over stuffed - can serve 2 persons easily thus cost effective!,price,positive
train,3256,3256::cat::0,And comparing it to the Chinatown restaurants is simply not fair.,anecdotes/miscellaneous,neutral
train,211,211::cat::0,Service and food is what any one would expect when spending that type of money.,food,neutral
train,211,211::cat::1,Service and food is what any one would expect when spending that type of money.,service,neutral
train,524,524::cat::0,LOVE the atmosphere - felt like I was in Paris.,ambience,positive
train,801,801::cat::0,Every course was better than the next.,food,positive
train,3431,3431::cat::0,"Not cheap, but not that expensive either.",price,conflict
train,266,266::cat::0,The staff is incredibly helpful and attentive.,service,positive
train,1986,1986::cat::0,"If presentation and service is your thing, then this magic show works.",service,positive
train,1240,1240::cat::0,"Apparently, the good cook works then.",food,positive
train,955,955::cat::0,I was pleasantly suprised.,anecdotes/miscellaneous,positive
train,1787,1787::cat::0,The Yellowtail was particularly good as well.,food,positive
train,682,682::cat::0,One less manhattanite the better.,anecdotes/miscellaneous,neutral
train,2131,2131::cat::0,Everyone is welcomed in as family.,service,positive
train,2349,2349::cat::0,I ate clams oreganta and spectacular salad with perfectly marinated cucumbers and tomatoes with lots of shrimp and basil.,food,positive
train,2485,2485::cat::0,"The menu changed, portions were even smaller than before, a lentil dish was salty beyond edibility, a basmati rice dish lacked flavor.",food,negative
train,2412,2412::cat::0,"Spice is sleek, modern and cool with a menu that will not hurt your wallet.",ambience,positive
train,2412,2412::cat::1,"Spice is sleek, modern and cool with a menu that will not hurt your wallet.",price,positive
train,2647,2647::cat::0,Patroon features a nice cigar bar and has great staff.,service,positive
train,2647,2647::cat::1,Patroon features a nice cigar bar and has great staff.,ambience,positive
train,2311,2311::cat::0,"Hey, I think $2+ for a 5 block walk ain't bad.",anecdotes/miscellaneous,neutral
train,714,714::cat::0,Very affordable and excellent ambient!,ambience,positive
train,714,714::cat::1,Very affordable and excellent ambient!,price,positive
train,3057,3057::cat::0,Look elsewhere.,anecdotes/miscellaneous,negative
train,3002,3002::cat::0,"More important, the sushi rivals the best in Tokyo.",food,positive
train,2616,2616::cat::0,I have never had cheescake like this.,food,positive
train,2969,2969::cat::0,"Bill a little high, but worth it.",price,conflict
train,1147,1147::cat::0,"I seriously doubt I will ever dine at Jimmy's Bronx, or for that matter, Jimmy's Uptown, again.",anecdotes/miscellaneous,negative
train,3521,3521::cat::0,Everyone I bring here always loves it.,anecdotes/miscellaneous,positive
train,2410,2410::cat::0,"My co-workers had to wait almost an hour for delivery, only to discover that what they got was not what they ordered.",service,negative
train,2099,2099::cat::0,Worth a visit.,anecdotes/miscellaneous,positive
train,2792,2792::cat::0,A real dissapointment.,anecdotes/miscellaneous,negative
train,3206,3206::cat::0,Its a go-to for dates as well as entertaining out of town guests.,ambience,positive
train,837,837::cat::0,Why do people rave about the ambience.,ambience,negative
train,1244,1244::cat::0,Were meeting up with some friends for a drink at Lafayette 161 and happened to walk by Thai Angel famished.,anecdotes/miscellaneous,neutral
train,1343,1343::cat::0,"Fluke sashimi drizzled with jalapeno-lime olive oil, the fruit of the oil nicely highlighting the fish's sweetness.",food,positive
train,348,348::cat::0,Great sushi experience.,food,positive
train,1956,1956::cat::0,"If you're looking for a great meal at a decent price, go to Del Frisco's!",food,positive
train,1956,1956::cat::1,"If you're looking for a great meal at a decent price, go to Del Frisco's!",price,positive
train,2039,2039::cat::0,They charge $6.00 for rice.,price,negative
train,2990,2990::cat::0,My steak au poivre was one of the worst I've had.,food,negative
train,2135,2135::cat::0,"On a recent Sunday afternoon, a friend and I accidently found this great restaurant on our way to see the pulitzer prize winning play DOUBT.",anecdotes/miscellaneous,positive
train,1779,1779::cat::0,The owner and staff are all Japanese as well and that adds to the entire ambiance.,ambience,positive
train,142,142::cat::0,"Try the congee and the donut like deep fried dough they call Ow Ley Soh, a delicious and sweet tasting bread.",food,positive
train,2768,2768::cat::0,"Although the tables may be closely situated, the candle-light, food-quality and service overcompensate.",food,positive
train,2768,2768::cat::1,"Although the tables may be closely situated, the candle-light, food-quality and service overcompensate.",service,positive
train,2768,2768::cat::2,"Although the tables may be closely situated, the candle-light, food-quality and service overcompensate.",ambience,conflict
train,812,812::cat::0,The food was delicious and the waiter was incredibly helpful and attentive (considering we were the only ones there for the first hour).,food,positive
train,812,812::cat::1,The food was delicious and the waiter was incredibly helpful and attentive (considering we were the only ones there for the first hour).,service,positive
train,218,218::cat::0,"From the spectacular caviar to the hospitable waitstaff, I felt like royalty and enjoyed every second of it.",food,positive
train,218,218::cat::1,"From the spectacular caviar to the hospitable waitstaff, I felt like royalty and enjoyed every second of it.",service,positive
train,91,91::cat::0,I will be going back and heartily recommend it!,anecdotes/miscellaneous,positive
train,2970,2970::cat::0,Would definitely visit again.,anecdotes/miscellaneous,positive
train,1004,1004::cat::0,Definitely worth the trip to Battery Park City!,anecdotes/miscellaneous,positive
train,1204,1204::cat::0,"Perhaps this food is considered extreme to an Upper East Side resident, but for the rest of us who've actually eaten ethnic food, this is simply dull.",food,conflict
train,811,811::cat::0,The place was real empty but that was because this was the first Sunday they ever opened.,ambience,conflict
train,2239,2239::cat::0,This little place definitely exceeded my expectations and you sure get a lot of food for your money.,price,positive
train,2239,2239::cat::1,This little place definitely exceeded my expectations and you sure get a lot of food for your money.,ambience,conflict
train,3493,3493::cat::0,"Ambience is delightful, service impeccable.",service,positive
train,3493,3493::cat::1,"Ambience is delightful, service impeccable.",ambience,positive
train,503,503::cat::0,"Service was excellent, and the AC worked very well too (thank God, it was hot!).",service,positive
train,503,503::cat::1,"Service was excellent, and the AC worked very well too (thank God, it was hot!).",ambience,positive
train,2094,2094::cat::0,Tasty but expensive.,food,positive
train,2094,2094::cat::1,Tasty but expensive.,price,negative
train,3236,3236::cat::0,You get the sense that the people there care about their restaurant and about your experience and that is very nice.,service,positive
train,1606,1606::cat::0,"Both are delicious, the cooks are friendly and are willing to take a moment and speak to you and shake your hand.",food,positive
train,1606,1606::cat::1,"Both are delicious, the cooks are friendly and are willing to take a moment and speak to you and shake your hand.",service,positive
train,1307,1307::cat::0,so i thought why not change it up a bit.,anecdotes/miscellaneous,neutral
train,300,300::cat::0,My friend ordered some of their special sushi rolls which had excellent presentation and tasted great!,food,positive
train,2334,2334::cat::0,Although be warned their dinner menu to sit and take out prices are different.,price,neutral
train,2079,2079::cat::0,"The staff was accomodating, the food was absolutely delicious and the place is lovely.",food,positive
train,2079,2079::cat::1,"The staff was accomodating, the food was absolutely delicious and the place is lovely.",service,positive
train,2079,2079::cat::2,"The staff was accomodating, the food was absolutely delicious and the place is lovely.",ambience,positive
train,2602,2602::cat::0,P.S. Please don't tell anyone in my family i eat there.,anecdotes/miscellaneous,neutral
train,1424,1424::cat::0,"my picks are: - Scallion Pancake (fried with vegetable juice, very special and tasty) - Guizhou Chicken - Shredded Squid Family Style (one of my personal favorites) - Sichuan Spicy Soft Shell Crab - Shuizhu Fish (this one is for hardcore Sichuan food fans, I wouldn't recommend to my American friends as it's very spicy.",food,positive
train,1294,1294::cat::0,They smell like they stuff them with old canned vegetables like the spinach mushroom calzone.,food,negative
train,2361,2361::cat::0,"To celebrate a birthday, three of us went to Mare anticipating great food.",anecdotes/miscellaneous,neutral
train,316,316::cat::0,There was a great deal for 6 Blue Point oysters and a beer or glass of wine for $8!,price,positive
train,1393,1393::cat::0,I really liked the noodle dishes at Rice Avenue compared to their Green Curry dish.,food,conflict
train,3182,3182::cat::0,"I went to pams with my girlfriend, and i love it.",anecdotes/miscellaneous,positive
train,1317,1317::cat::0,"But for whatever reason, prices are about twice as high.",price,negative
train,1213,1213::cat::0,I am relatively new to the area and tried Pick a bgel on 2nd and was disappointed with the service and I thought the food was overated and on the pricey side.,anecdotes/miscellaneous,neutral
train,1213,1213::cat::1,I am relatively new to the area and tried Pick a bgel on 2nd and was disappointed with the service and I thought the food was overated and on the pricey side.,service,negative
train,1213,1213::cat::2,I am relatively new to the area and tried Pick a bgel on 2nd and was disappointed with the service and I thought the food was overated and on the pricey side.,price,negative
train,1213,1213::cat::3,I am relatively new to the area and tried Pick a bgel on 2nd and was disappointed with the service and I thought the food was overated and on the pricey side.,food,negative
train,1281,1281::cat::0,Great atmoshere and worth every bit.,ambience,positive
train,1537,1537::cat::0,We had a most unpleasant experience at this restaurant.,anecdotes/miscellaneous,negative
train,2262,2262::cat::0,"The spicy tuna roll was unusually good and the rock shrimp tempura was awesome, great appetizer to share!",food,positive
train,3456,3456::cat::0,The staff was knowledgeable and full of personality.,service,positive
train,1738,1738::cat::0,Great staff.,service,positive
train,1081,1081::cat::0,"Only complaint would be that at an average cost of $12-$15 per meal, I'd like not to have to worry about finding a seat!",service,negative
train,1081,1081::cat::1,"Only complaint would be that at an average cost of $12-$15 per meal, I'd like not to have to worry about finding a seat!",price,negative
train,1117,1117::cat::0,"To finish off such a delightful dinner experience you must have dessert, especially the White Chocolate Bread Pudding with Gelato and hot chocolate.",food,positive
train,306,306::cat::0,The banana tower is an amazing dessert as well.,food,positive
train,2112,2112::cat::0,I went there with my friend last saturday.,anecdotes/miscellaneous,neutral
train,94,94::cat::0,"Excellent atmosphere, delicious dishes good and friendly service.",food,positive
train,94,94::cat::1,"Excellent atmosphere, delicious dishes good and friendly service.",service,positive
train,94,94::cat::2,"Excellent atmosphere, delicious dishes good and friendly service.",ambience,positive
train,1015,1015::cat::0,A cool place to hang with your friends for a couple of healthy drinks and desserts.,food,positive
train,1015,1015::cat::1,A cool place to hang with your friends for a couple of healthy drinks and desserts.,ambience,positive
train,1901,1901::cat::0,"Great vibe, lots of people.",ambience,positive
train,2422,2422::cat::0,"I like Mamoun's food as well, but side by side, Kati Rolls just produce tastier food hands down.",food,conflict
train,200,200::cat::0,Just an odd group.,anecdotes/miscellaneous,neutral
train,1607,1607::cat::0,"The service is a bit slow, but harkens back to my years growing up in Napoli, Italy where things are not rushed and when you sit down for dinner the table is yours all night.",service,conflict
train,2771,2771::cat::0,"Either that, or the editor's idea of romance must be sharing a conversation with the next table, while trying to speak louder than the traffic on 57th.",ambience,negative
train,1400,1400::cat::0,I love this place!,anecdotes/miscellaneous,positive
train,1019,1019::cat::0,it is not consistent.,anecdotes/miscellaneous,negative
train,2793,2793::cat::0,But that wasn't the icing on the cake: a tiramisu that resembled nothing I have ever had.,food,negative
train,2332,2332::cat::0,Great food and the prices are very reasonable.,food,positive
train,2332,2332::cat::1,Great food and the prices are very reasonable.,price,positive
train,215,215::cat::0,Wine list is not huge but def well selected.,food,conflict
train,58,58::cat::0,"A cool bar with great food, and tons of excellent beer.",food,positive
train,58,58::cat::1,"A cool bar with great food, and tons of excellent beer.",ambience,positive
train,536,536::cat::0,"Be sure to try the seasonal, and always delicious, specials.",food,positive
train,869,869::cat::0,The ambience is authentic and relaxing and we have always received attentive and prompt service.,ambience,positive
train,869,869::cat::1,The ambience is authentic and relaxing and we have always received attentive and prompt service.,service,positive
train,2961,2961::cat::0,"Fresh, authentic, french cuisine in substantial portions.",food,positive
train,1355,1355::cat::0,"Drinks got screwed up, she acted put upon.",service,negative
train,2085,2085::cat::0,The one vegetarian entree (Abby's treasure) was actually quite a surprise - it was delicious and had wintermelon covering an assortment of fresh mushrooms and vegetables.,food,positive
train,1173,1173::cat::0,"At 5 dumplings for $1, you just cannot go wrong.",price,positive
train,1470,1470::cat::0,But the pizza is way to expensive.,price,negative
train,2457,2457::cat::0,"And the staff is also young, energeic and hot!!!!",service,positive
train,505,505::cat::0,"Even better, they know how to cook French classics like Steak au Poivre and Onglet without burning it to death or overcooking it.",food,positive
train,842,842::cat::0,"Service was decent, but not as smooth as I would expect from a place with these prices and reputation.",service,conflict
train,1595,1595::cat::0,We had a wonderful meal at Naples 45 a month ago on a visit to NYC.,food,positive
train,2150,2150::cat::0,Good drink.,food,positive
train,2443,2443::cat::0,"Great food (spinach and corn dumplings and massamman curry), very friendly and no nonsense service and a clean and funky bathroom.",food,positive
train,2443,2443::cat::1,"Great food (spinach and corn dumplings and massamman curry), very friendly and no nonsense service and a clean and funky bathroom.",service,positive
train,2443,2443::cat::2,"Great food (spinach and corn dumplings and massamman curry), very friendly and no nonsense service and a clean and funky bathroom.",ambience,positive
train,3706,3706::cat::0,Was there Friday night.,anecdotes/miscellaneous,neutral
train,2010,2010::cat::0,We had a girls' night dinner here for restaurant week.,anecdotes/miscellaneous,neutral
train,3064,3064::cat::0,Romantic if you want it to be (brightly lit).,ambience,positive
train,3483,3483::cat::0,"However, I was there for a work dinner not long ago when my colleague from London noticed a very large waterbug on the ceiling.",anecdotes/miscellaneous,negative
train,1719,1719::cat::0,I recommend it!,anecdotes/miscellaneous,positive
train,2442,2442::cat::0,I have taken practically every guest that has come to visit me in NY and hooked a few New Yorkers onto Peep as well.,anecdotes/miscellaneous,positive
train,3101,3101::cat::0,enough said!,anecdotes/miscellaneous,neutral
train,542,542::cat::0,I don't live in NY but my best friend does.,anecdotes/miscellaneous,neutral
train,255,255::cat::0,My chow fun and chow see was really bland and oily.,food,negative
train,828,828::cat::0,"Even though I made the reservation at 3pm for the same night through Dinnerbroker, we were seated at a table with one of the best view!",anecdotes/miscellaneous,positive
train,828,828::cat::1,"Even though I made the reservation at 3pm for the same night through Dinnerbroker, we were seated at a table with one of the best view!",ambience,positive
train,3553,3553::cat::0,"we did notice however, that some tables had what looked like pita instead of naan.",service,negative
train,315,315::cat::0,"I didn't take a look at the rest menu, but the oysters were fantastic.",food,positive
