split,sentence_id,category_id,text,category,polarity
train,2147,2147::cat::0,I recommend this place to everyone who asks me where to go for a good meal.,anecdotes/miscellaneous,positive
train,480,480::cat::0,The waitresses are nice--also you can just get counter service sit.,service,positive
train,37,37::cat::0,The only friendly staff member was the guy at the bar.,service,conflict
train,3160,3160::cat::0,"Having been a long time Ess-a-Bagel fan, I was surpised to find myself return time and time again to Murray's.",anecdotes/miscellaneous,positive
train,3069,3069::cat::0,Go for it!,anecdotes/miscellaneous,positive
train,2072,2072::cat::0,Highly recommended.,anecdotes/miscellaneous,positive
train,1456,1456::cat::0,"You can certainly find restaurants that offer a superior fine dining experience, but for superb food at reasonable prices, La Villa can't be beat.",food,positive
train,1456,1456::cat::1,"You can certainly find restaurants that offer a superior fine dining experience, but for superb food at reasonable prices, La Villa can't be beat.",anecdotes/miscellaneous,positive
train,1456,1456::cat::2,"You can certainly find restaurants that offer a superior fine dining experience, but for superb food at reasonable prices, La Villa can't be beat.",price,positive
train,3174,3174::cat::0,Won't or Can't is not in the service directory.,service,positive
train,3413,3413::cat::0,I cannot imagine a friendlier staff working in a restaurant.,service,positive
train,1954,1954::cat::0,I do suggest to ask to be seated upstairs if you are looking to be a little cozy.,anecdotes/miscellaneous,neutral
train,1954,1954::cat::1,I do suggest to ask to be seated upstairs if you are looking to be a little cozy.,ambience,positive
train,643,643::cat::0,"To speak of the Park Side, words can not describe.",anecdotes/miscellaneous,neutral
train,1271,1271::cat::0,"The red curry is weak and tasteless, the pad thai is stuck together and lumpy, the rice is often overcooked, and the seafood is pretty sketchy.",food,negative
train,1631,1631::cat::0,The wine list is extensive and can easily hike up an otherwise reasonably priced meal.,food,positive
train,1631,1631::cat::1,The wine list is extensive and can easily hike up an otherwise reasonably priced meal.,price,positive
train,689,689::cat::0,"Saul is pretty good, but definitely not great.",food,positive
train,3580,3580::cat::0,"I would recommend Roxy's for that, but not for their food.",food,negative
train,3580,3580::cat::1,"I would recommend Roxy's for that, but not for their food.",anecdotes/miscellaneous,positive
train,3524,3524::cat::0,We always get a sampling of appetizers and share.,anecdotes/miscellaneous,neutral
train,510,510::cat::0,"Overall I was impressed and will return, it's a great QPR (Quality to Price Ratio).",anecdotes/miscellaneous,positive
train,510,510::cat::1,"Overall I was impressed and will return, it's a great QPR (Quality to Price Ratio).",price,positive
train,600,600::cat::0,"It is nearly impossible to get a table, so if you ever have the chance to go here for dinner, DO NOT pass it up.",anecdotes/miscellaneous,conflict
train,424,424::cat::0,Their pad penang is delicious and everything else is fantastic.,food,positive
train,3091,3091::cat::0,"The puke green walls leave a lot to be desired, but the food is very good.",food,positive
train,3091,3091::cat::1,"The puke green walls leave a lot to be desired, but the food is very good.",ambience,negative
train,676,676::cat::0,"The flavors are very fresh and pretty inobtrusive, nothing flashy.",food,positive
train,7,7::cat::0,"I like Cafe Noir dont get me wrong, it is jsut that the people who work there are evil and incompetent!!",service,negative
train,1371,1371::cat::0,The hanger steak was like rubber and the tuna was flavorless not to mention it tasted like it had just been thawed.,food,negative
train,2091,2091::cat::0,But $1 for each small piece???,price,negative
train,1596,1596::cat::0,"Our son loves pizza and we have a certified Neapolitan pizzaria in our home city (Seattle), we liked this nearly as much - and the differences were more about personal preference than any reflection on either restaurant.",anecdotes/miscellaneous,positive
train,1232,1232::cat::0,big and soft as well as good lunch food.,food,positive
train,967,967::cat::0,"No food snobs allowed, this place is for people who appreciate good food.",anecdotes/miscellaneous,neutral
train,967,967::cat::1,"No food snobs allowed, this place is for people who appreciate good food.",food,positive
train,1127,1127::cat::0,I liked the food at this quasi-thai restaurant.,food,positive
train,2576,2576::cat::0,By far the best salad I have had in a fast food restaurant.,food,positive
train,2242,2242::cat::0,Suan is a great place that I often take my friends (classmates) too.,anecdotes/miscellaneous,positive
train,2650,2650::cat::0,Not a great place for family or general dining.,anecdotes/miscellaneous,negative
train,2529,2529::cat::0,"As for the bar, this is another bad idea.",food,negative
train,3167,3167::cat::0,"Their bagels are fine, but they are a little overcooked, and not really a 'special' bagel experience.",food,conflict
train,1217,1217::cat::0,"Unlike HH up the block, this place actually gives you hearty and hot bagels this town is known for.",food,positive
train,1149,1149::cat::0,I thought going to Jimmys would give me a real Domincan exprience.,anecdotes/miscellaneous,neutral
train,2644,2644::cat::0,The barebecued salmon is elegantly spiced and not at all dry.,food,positive
train,2812,2812::cat::0,"Same owner as the guy who owns Typhoon, which is just down the street on St. Marks and 1st Ave.",anecdotes/miscellaneous,neutral
train,1028,1028::cat::0,What generous portions!,food,positive
train,2167,2167::cat::0,The workers there also absolutely load the bagel with cream cheese (gets a little messy).,food,neutral
train,795,795::cat::0,I was wrong.,anecdotes/miscellaneous,negative
train,573,573::cat::0,The wine the service was very good too.,food,positive
train,573,573::cat::1,The wine the service was very good too.,service,positive
train,1082,1082::cat::0,"So, the menu is written in chalk above your head and it all sounds delicious.",food,positive
train,1082,1082::cat::1,"So, the menu is written in chalk above your head and it all sounds delicious.",ambience,positive
train,1080,1080::cat::0,The highly spiced chai tea was great too.,food,positive
train,2929,2929::cat::0,No plans to return anytime soon.,anecdotes/miscellaneous,negative
train,752,752::cat::0,"I have been there many times, and food is good and consistent.",food,positive
train,1641,1641::cat::0,"Seriously, this is the best all you can eat in town- As everyone says, the Spicy Tuna hand rolls are the best- have 4 of these, and you've broken even.",food,positive
train,3257,3257::cat::0,There is not a single place in Chinatown where you have a nice neighborhood feeling like here.,ambience,positive
train,2897,2897::cat::0,"While Sapphire is certainly not lacking in ambiance, and probably has the best decor of any Indian restaurant I have been to in New York City, the food was not what I had hoped for.",food,negative
train,2897,2897::cat::1,"While Sapphire is certainly not lacking in ambiance, and probably has the best decor of any Indian restaurant I have been to in New York City, the food was not what I had hoped for.",ambience,positive
train,872,872::cat::0,I would highly recommend this place to anyone looking for a casual atmosphere that whisks you away to the left bank of the river Seine.,anecdotes/miscellaneous,positive
train,872,872::cat::1,I would highly recommend this place to anyone looking for a casual atmosphere that whisks you away to the left bank of the river Seine.,ambience,positive
train,2828,2828::cat::0,I just do not understand what the fuss is all about.,anecdotes/miscellaneous,negative
train,2086,2086::cat::0,The meat dishes were only so-so.,food,neutral
train,3507,3507::cat::0,"His wife Tanya, the hostess, completes the comforting atmosphere by being delightfully warm and gracious.",service,positive
train,3507,3507::cat::1,"His wife Tanya, the hostess, completes the comforting atmosphere by being delightfully warm and gracious.",ambience,positive
train,635,635::cat::0,"We liked it so much, that we will always make it a point to dine here when we visit New York.",anecdotes/miscellaneous,positive
train,957,957::cat::0,"The menu consisted of standard brassiere food, better then places like Balthazar etc.",food,positive
train,2249,2249::cat::0,"I have been a longtime fan of Holy Basil in the East Village, and while I do believe their food has slightly slipped in quality, I have been hesitant to be disloyal.",anecdotes/miscellaneous,neutral
train,2249,2249::cat::1,"I have been a longtime fan of Holy Basil in the East Village, and while I do believe their food has slightly slipped in quality, I have been hesitant to be disloyal.",food,negative
train,1724,1724::cat::0,"But the best part about LS is the late night atmosphere, delightfully free of the BTs.",ambience,positive
train,761,761::cat::0,For an untrendy rip-off- eat here.,anecdotes/miscellaneous,negative
train,1640,1640::cat::0,And you're hungry a few hours later.,food,neutral
train,2322,2322::cat::0,I can't wait to go back.,anecdotes/miscellaneous,positive
train,3476,3476::cat::0,I HATE HATE HATE this place.,anecdotes/miscellaneous,negative
train,2080,2080::cat::0,We even had a visit from the Manager who wanted to make sure we were enjoying ourselves.,anecdotes/miscellaneous,positive
train,2080,2080::cat::1,We even had a visit from the Manager who wanted to make sure we were enjoying ourselves.,service,positive
train,866,866::cat::0,The staff there is very attentive and down to earth.,service,positive
train,1031,1031::cat::0,"You don't go to Mizu for excellent service, you go for the large amounts of food, the amiable atmosphere, and the hole-in-the-wall feeling of the place.",food,positive
train,1031,1031::cat::1,"You don't go to Mizu for excellent service, you go for the large amounts of food, the amiable atmosphere, and the hole-in-the-wall feeling of the place.",service,negative
train,1031,1031::cat::2,"You don't go to Mizu for excellent service, you go for the large amounts of food, the amiable atmosphere, and the hole-in-the-wall feeling of the place.",ambience,positive
train,712,712::cat::0,"The service is always bad though, don't expect much of anything from your server, and I would not recommend bringing a date here either.",service,negative
train,3226,3226::cat::0,Monday nights are a bargain at the $28 prix fix - this includes a three course meal plus *three* glasses of wine paired with each course.,price,positive
train,3093,3093::cat::0,Wonderful!,anecdotes/miscellaneous,positive
train,931,931::cat::0,It took them 15 minutes to put water in our glasses.,service,negative
train,979,979::cat::0,The service is descent even when this small place is packed.,service,positive
train,1205,1205::cat::0,This is the best sushi in new york city - hands down.,food,positive
train,1414,1414::cat::0,Go hungry and enjoy.,anecdotes/miscellaneous,positive
train,3603,3603::cat::0,I have eaten a lot of pizza here.,anecdotes/miscellaneous,neutral
train,2809,2809::cat::0,This place is worth an one-hour drive.,anecdotes/miscellaneous,positive
train,2567,2567::cat::0,Great value for the quality ingredients.,food,positive
train,2567,2567::cat::1,Great value for the quality ingredients.,price,positive
train,1419,1419::cat::0,"The Thali was small, thoroughly unremarkable, and $14.95.",food,negative
train,1419,1419::cat::1,"The Thali was small, thoroughly unremarkable, and $14.95.",price,negative
train,305,305::cat::0,The sushi is also great!,food,positive
train,2843,2843::cat::0,From the complimentary chef app of a delicate butternut squash ravioli in a delicious truffle sauce to an amazing buttery and tender langostine entree to a dessert that I can't remember because of the fabulous Cakebread Cabernet we were drinking -- the whole evening was amazing.,food,positive
train,1931,1931::cat::0,Truly the mark of an attentive waiter.,service,positive
train,181,181::cat::0,"The food here is rather good, but only if you like to wait for it.",food,positive
train,181,181::cat::1,"The food here is rather good, but only if you like to wait for it.",service,negative
train,3579,3579::cat::0,I got an excellent piece of cheesecake and we had several other nice pastries.,food,positive
train,2455,2455::cat::0,"The staff is very kind and well trained, they're fast, they are always prompt to jump behind the bar and fix drinks, they know details of every item in the menu and make excelent recomendations.",service,positive
train,2040,2040::cat::0,The makhani was OK --the korma was bland.,food,negative
train,3080,3080::cat::0,The food is inventive but still keeps traditional indian flavoring.,food,positive
train,2849,2849::cat::0,All I can say is WOW!,anecdotes/miscellaneous,positive
train,1465,1465::cat::0,"though the service could be better (possibly due to more than one very large group in the house), it is very cordial and warm, as is the general clientele.",service,conflict
train,1465,1465::cat::1,"though the service could be better (possibly due to more than one very large group in the house), it is very cordial and warm, as is the general clientele.",ambience,conflict
train,2927,2927::cat::0,"The decor in this place is very diner-ish and the kind of place you expect in the East Village - not romantic, just simple, small and sparse.",ambience,positive
train,1544,1544::cat::0,This is a cute place and could be good but they need to get their act together.,anecdotes/miscellaneous,conflict
train,1544,1544::cat::1,This is a cute place and could be good but they need to get their act together.,ambience,positive
train,2161,2161::cat::0,The lox is always fresh too.,food,positive
train,3115,3115::cat::0,"Sure enough, exactly 30 minutes later we got the call and were seated promptly.",service,positive
train,1341,1341::cat::0,Service was very friendly.,service,positive
train,3468,3468::cat::0,So all I'm trying to say is this restaurant is by far the best thai food restaurant I've ever been to.,food,positive
train,3468,3468::cat::1,So all I'm trying to say is this restaurant is by far the best thai food restaurant I've ever been to.,anecdotes/miscellaneous,positive
train,840,840::cat::0,Food was OK - fish was cooked well.,food,positive
train,1011,1011::cat::0,We actually left hungry and went across the street to Wo Hop at 15 Mott street for some good chinese food.,anecdotes/miscellaneous,negative
train,1011,1011::cat::1,We actually left hungry and went across the street to Wo Hop at 15 Mott street for some good chinese food.,food,positive
train,698,698::cat::0,The duck confit is always amazing and the foie gras terrine with figs was out of this world.,food,positive
train,14,14::cat::0,"The whole set up is truly unprofessional and I wish Cafe Noir would get some good staff, because despite the current one this is a great place.",service,negative
train,557,557::cat::0,The service does sometimes lack focus and it is not ideal if you are in a hurry but I have never been treated rudely.,service,conflict
train,3302,3302::cat::0,The staff offers impeccable service.,service,positive
train,1651,1651::cat::0,The catch is that you are charged extra for ANYTHING that you leave on your plate so don't be a greedy pig!,anecdotes/miscellaneous,negative
train,1651,1651::cat::1,The catch is that you are charged extra for ANYTHING that you leave on your plate so don't be a greedy pig!,price,negative
train,160,160::cat::0,We ended our great experience by having Gulab Jamun (dessert) recommended by the waiter.,food,positive
train,1777,1777::cat::0,wont come back again for sure!,anecdotes/miscellaneous,negative
train,919,919::cat::0,i went to utsav about a yr ago with my family.,anecdotes/miscellaneous,neutral
train,2427,2427::cat::0,"This place doesn't compare with Mamoun's in terms of price, freshness, value, and consisent quality, but that's just my opinion.",food,negative
train,2427,2427::cat::1,"This place doesn't compare with Mamoun's in terms of price, freshness, value, and consisent quality, but that's just my opinion.",price,negative
train,2404,2404::cat::0,"The place is sleek, modern and playfull and i will return again frequently.",ambience,positive
train,116,116::cat::0,"I have known about this secret for the last 13 years, Emilio(the Godfather) has continued to serve food and wine for the gods at mortal prices.",price,positive
train,116,116::cat::1,"I have known about this secret for the last 13 years, Emilio(the Godfather) has continued to serve food and wine for the gods at mortal prices.",food,positive
train,2008,2008::cat::0,The brioche and lollies as party favors is a cute and sweet touch to a most memorable meal.,food,positive
train,2206,2206::cat::0,"After being told that our party of three would be seated in 10 minutes and watching other parties (multiples of 2 and higher) seated for 40 minutes, the three of us were squished into a small 2-person table.",anecdotes/miscellaneous,negative
train,2206,2206::cat::1,"After being told that our party of three would be seated in 10 minutes and watching other parties (multiples of 2 and higher) seated for 40 minutes, the three of us were squished into a small 2-person table.",service,negative
train,1010,1010::cat::0,And the bill was outragous.,price,negative
train,89,89::cat::0,"The service was attentive, yet unimposing, the food was far better than many notorious restaurants in Midtown and the wine list is extensive and well priced.",food,positive
train,89,89::cat::1,"The service was attentive, yet unimposing, the food was far better than many notorious restaurants in Midtown and the wine list is extensive and well priced.",service,positive
train,89,89::cat::2,"The service was attentive, yet unimposing, the food was far better than many notorious restaurants in Midtown and the wine list is extensive and well priced.",price,positive
train,2994,2994::cat::0,"Kind, attentive wait staff.",service,positive
train,879,879::cat::0,Bon appettite!!,anecdotes/miscellaneous,positive
train,2572,2572::cat::0,Salads were fantastic.,food,positive
train,1288,1288::cat::0,The owners and employees are friendly and their pizza is fantastic.,food,positive
train,1288,1288::cat::1,The owners and employees are friendly and their pizza is fantastic.,service,positive
train,3604,3604::cat::0,"La Rosa waltzes in, and I think they are doing it the best.",anecdotes/miscellaneous,positive
train,1723,1723::cat::0,"The food is yummy, especially their cooked-to-perfection mussels in spicy tomato sauce and their shoestring crispy fries.",food,positive
train,3491,3491::cat::0,The food is authentic Italian - delicious!,food,positive
train,3610,3610::cat::0,"A great addition to Smith Street: finally, a place that's not pretentious and filled with women wearing Ugg boots.",anecdotes/miscellaneous,positive
train,2909,2909::cat::0,skip dessert.,food,negative
train,2656,2656::cat::0,We spent $200 in this place and left hungry and very disappointed.,anecdotes/miscellaneous,negative
train,2656,2656::cat::1,We spent $200 in this place and left hungry and very disappointed.,price,negative
train,2598,2598::cat::0,It is simply amazing.,anecdotes/miscellaneous,positive
train,3172,3172::cat::0,I complete the total bagel experience by having it lightly toasted.,anecdotes/miscellaneous,neutral
train,1795,1795::cat::0,It was like the servers forgot that they actually worked there and instead wanted to hang out and be cool.,service,negative
train,2992,2992::cat::0,I liked this place the first time but doubt I will ever return.,anecdotes/miscellaneous,negative
train,3438,3438::cat::0,The service is good and ambience is good for a date or group outing.,service,positive
train,3438,3438::cat::1,The service is good and ambience is good for a date or group outing.,ambience,positive
train,1276,1276::cat::0,A great way to make some money is to buy a case of snapple from Costco and sell it right outside for only $2.50.,anecdotes/miscellaneous,neutral
train,730,730::cat::0,It's all about the food !!,food,positive
train,1870,1870::cat::0,Fast service.,service,positive
train,2367,2367::cat::0,"Skip this restaurant, it's a big disappointment.",anecdotes/miscellaneous,negative
train,1519,1519::cat::0,"The staff is excellent, specjal: that girl behind the bar, european chic.",service,positive
train,2904,2904::cat::0,"stick with the chicken, beef, and lamb dishes.",food,positive
train,1009,1009::cat::0,"The service was bad, the food took to forever to come, we sat on the upper level.",service,negative
train,2642,2642::cat::0,"We a menu that rearely changes,e xcept for one or two specials, the quality and care they put in thier food in evident.",food,positive
train,43,43::cat::0,ALWAYS full with tourists (especially because of it's close proximity to Rockefeller Center).,ambience,neutral
train,1460,1460::cat::0,"The decor is nice, but more casual than fine dining.",ambience,conflict
train,307,307::cat::0,This restaurant is a wonderful place to go many times and it is reasonably priced.,anecdotes/miscellaneous,positive
train,307,307::cat::1,This restaurant is a wonderful place to go many times and it is reasonably priced.,price,positive
train,860,860::cat::0,"Bravo, Blue Hill!",anecdotes/miscellaneous,positive
train,2594,2594::cat::0,"Conveniently located too, being right on Bedford ave.",anecdotes/miscellaneous,positive
train,607,607::cat::0,My friends and I came across this place while walking in the village.,anecdotes/miscellaneous,neutral
train,1338,1338::cat::0,"Bottom line: B+ for the food, F for the service.",food,positive
train,1338,1338::cat::1,"Bottom line: B+ for the food, F for the service.",service,negative
train,1625,1625::cat::0,The only thing the waiters don't do for you is wipe your chin when you leave.,service,positive
train,2665,2665::cat::0,This place is to be avoided.,anecdotes/miscellaneous,negative
train,2095,2095::cat::0,"Stick to dimsum, not super overpriced noodles.",food,negative
train,2095,2095::cat::1,"Stick to dimsum, not super overpriced noodles.",price,negative
train,989,989::cat::0,The service is fine and they allow you to enjoy the view.,service,positive
train,989,989::cat::1,The service is fine and they allow you to enjoy the view.,ambience,positive
train,1803,1803::cat::0,My sister says it reminds her of a restaurant run by high-school students who don't know what they are doing.,anecdotes/miscellaneous,negative
train,3047,3047::cat::0,"We, there were four of us, arrived at noon - the place was empty - and the staff acted like we were imposing on them and they were very rude.",service,negative
train,850,850::cat::0,"At 6:30, we were the third party there.",anecdotes/miscellaneous,neutral
train,2993,2993::cat::0,delicious simple food in nice outdoor atmosphere.,food,positive
train,2993,2993::cat::1,delicious simple food in nice outdoor atmosphere.,ambience,positive
train,2596,2596::cat::0,I will definetly be going back.,anecdotes/miscellaneous,positive
train,3602,3602::cat::0,"No, really.",anecdotes/miscellaneous,neutral
train,3108,3108::cat::0,"The food is good, but very expensive for the casualness of it.",food,conflict
train,3108,3108::cat::1,"The food is good, but very expensive for the casualness of it.",price,negative
train,3439,3439::cat::0,The only fallback on this restaurant is the prices.,price,negative
train,1604,1604::cat::0,I've been to Naples 45 for dinner twice.,anecdotes/miscellaneous,neutral
train,1440,1440::cat::0,The hot and sour soup was unbearably hot and tasted of only pepper and nothing else.,food,negative
train,101,101::cat::0,i love the pics of andy warhol when he used to frequent the place (he painted the ballato's sign in the window).,ambience,positive
train,351,351::cat::0,Try sushimi cucumber roll.,food,positive
train,2009,2009::cat::0,I'm saving up for my next visit.,anecdotes/miscellaneous,positive
train,988,988::cat::0,The food is delicious.,food,positive
train,2963,2963::cat::0,Their wines by the glass are a great accompaniment and you can eat like a king with wine for under $30.,food,positive
train,2963,2963::cat::1,Their wines by the glass are a great accompaniment and you can eat like a king with wine for under $30.,price,positive
train,3412,3412::cat::0,This place has the the correct ambience and an excellent staff to make you feel like a guest and a friend at the same time.,service,positive
train,3412,3412::cat::1,This place has the the correct ambience and an excellent staff to make you feel like a guest and a friend at the same time.,ambience,positive
train,1311,1311::cat::0,Amma is nothing special.,anecdotes/miscellaneous,negative
train,246,246::cat::0,Yeah Shanghai is also great but not quite as good -- they use the same amount of salt but without sweetness to balance out.,anecdotes/miscellaneous,neutral
train,246,246::cat::1,Yeah Shanghai is also great but not quite as good -- they use the same amount of salt but without sweetness to balance out.,food,neutral
train,1771,1771::cat::0,"believe us, we've been eating sushi for over 15 yrs.",anecdotes/miscellaneous,neutral
train,1913,1913::cat::0,"Worth it for a special occasion, or any time!",anecdotes/miscellaneous,positive
train,1394,1394::cat::0,The atmosphere is much better than Sripraphai (more modern and sleek).,ambience,positive
train,226,226::cat::0,I recommend to anyone who wants to dress up and impress the lady.,anecdotes/miscellaneous,positive
train,3642,3642::cat::0,"The food is outstanding and the service is quick, friendly and very professional.",food,positive
train,3642,3642::cat::1,"The food is outstanding and the service is quick, friendly and very professional.",service,positive
train,2159,2159::cat::0,"The bagels always warm, soft on the inside, crispy on the outside and enormous in size.",food,positive
