split,sentence_id,category_id,text,category,polarity
train,3121,3121::cat::0,But the staff was so horrible to us.,service,negative
train,2777,2777::cat::0,"To be completely fair, the only redeeming factor was the food, which was above average, but couldn't make up for all the other deficiencies of Teodora.",food,positive
train,2777,2777::cat::1,"To be completely fair, the only redeeming factor was the food, which was above average, but couldn't make up for all the other deficiencies of Teodora.",anecdotes/miscellaneous,negative
train,1634,1634::cat::0,"The food is uniformly exceptional, with a very capable kitchen which will proudly whip up whatever you feel like eating, whether it's on the menu or not.",food,positive
train,2534,2534::cat::0,Where Gabriela personaly greets you and recommends you what to eat.,service,positive
train,583,583::cat::0,"For those that go once and don't enjoy it, all I can say is that they just don't get it.",anecdotes/miscellaneous,positive
train,2846,2846::cat::0,"Not only was the food outstanding, but the little 'perks' were great.",food,positive
train,2846,2846::cat::1,"Not only was the food outstanding, but the little 'perks' were great.",service,positive
train,1571,1571::cat::0,It is very overpriced and not very tasty.,food,negative
train,1571,1571::cat::1,It is very overpriced and not very tasty.,price,negative
train,1458,1458::cat::0,Our agreed favorite is the orrechiete with sausage and chicken (usually the waiters are kind enough to split the dish in half so you get to sample both meats).,food,positive
train,1458,1458::cat::1,Our agreed favorite is the orrechiete with sausage and chicken (usually the waiters are kind enough to split the dish in half so you get to sample both meats).,service,positive
train,3161,3161::cat::0,"The Bagels have an outstanding taste with a terrific texture, both chewy yet not gummy.",food,positive
train,2391,2391::cat::0,Nevertheless the food itself is pretty good.,food,positive
train,296,296::cat::0,"They did not have mayonnaise, forgot our toast, left out ingredients (ie cheese in an omelet), below hot temperatures and the bacon was so over cooked it crumbled on the plate when you touched it.",food,negative
train,1793,1793::cat::0,"It took half an hour to get our check, which was perfect since we could sit, have drinks and talk!",service,conflict
train,2200,2200::cat::0,The design and atmosphere is just as good.,ambience,positive
train,3195,3195::cat::0,He has visited Thailand and is quite expert on the cuisine.,food,positive
train,3119,3119::cat::0,I would definitely recommend Mary's and am making it one of my regular neighborhood haunts.,anecdotes/miscellaneous,positive
train,3359,3359::cat::0,The pizza is the best if you like thin crusted pizza.,food,positive
train,70,70::cat::0,My Girlfriend and I stumbled onto this hopping place the other night and had a great time!,anecdotes/miscellaneous,positive
train,1829,1829::cat::0,"He can't help, they're bought up so fast.",anecdotes/miscellaneous,neutral
train,2935,2935::cat::0,"Secondly, on this night the place was overwhelmed by upper east side ladies perfume.",ambience,negative
train,1805,1805::cat::0,"i have eaten here a handful of times, for no reason besides sheer convenience.",anecdotes/miscellaneous,neutral
train,2559,2559::cat::0,Obviously run by folks who know a pie.,service,positive
train,716,716::cat::0,We were very disappointed.,anecdotes/miscellaneous,negative
train,2464,2464::cat::0,IT IS DEFINITELY SPECIAL AND AFFORDABLE.,anecdotes/miscellaneous,positive
train,2464,2464::cat::1,IT IS DEFINITELY SPECIAL AND AFFORDABLE.,price,positive
train,385,385::cat::0,I really liked this place.,anecdotes/miscellaneous,positive
train,1350,1350::cat::0,I will be going back very soon.,anecdotes/miscellaneous,positive
train,3534,3534::cat::0,"All the money went into the interior decoration, none of it went to the chefs.",ambience,positive
train,3534,3534::cat::1,"All the money went into the interior decoration, none of it went to the chefs.",food,negative
train,1407,1407::cat::0,The seats are uncomfortable if you are sitting against the wall on wooden benches.,ambience,negative
train,565,565::cat::0,"I asked for seltzer with lime, no ice.",food,neutral
train,387,387::cat::0,It was pretty inexpensive too.,price,positive
train,1314,1314::cat::0,Will not be back.,anecdotes/miscellaneous,negative
train,675,675::cat::0,"Don't go alone---even two people isn't enough for the whole experience, with pickles and a selection of meats and seafoods.",food,positive
train,2227,2227::cat::0,My suggestion is to eat family style because you'll want to try the other dishes.,food,neutral
train,3367,3367::cat::0,"Best of all is the warm vibe, the owner is super friendly and service is fast.",service,positive
train,3367,3367::cat::1,"Best of all is the warm vibe, the owner is super friendly and service is fast.",ambience,positive
train,1210,1210::cat::0,This isn't a value joint.,price,negative
train,2191,2191::cat::0,Faan's got a great concept but a little rough on the delivery.,anecdotes/miscellaneous,positive
train,2191,2191::cat::1,Faan's got a great concept but a little rough on the delivery.,service,negative
train,270,270::cat::0,"From the incredible food, to the warm atmosphere, to the friendly service, this downtown neighborhood spot doesn't miss a beat.",food,positive
train,270,270::cat::1,"From the incredible food, to the warm atmosphere, to the friendly service, this downtown neighborhood spot doesn't miss a beat.",service,positive
train,270,270::cat::2,"From the incredible food, to the warm atmosphere, to the friendly service, this downtown neighborhood spot doesn't miss a beat.",ambience,positive
train,638,638::cat::0,"Great food at REASONABLE prices, makes for an evening that can't be beat!",food,positive
train,638,638::cat::1,"Great food at REASONABLE prices, makes for an evening that can't be beat!",price,positive
train,500,500::cat::0,Look foward to trying the Ruben upon returning.,anecdotes/miscellaneous,positive
train,1108,1108::cat::0,The only other steakhouse that seems to hold a candle to Roth's is the Strip House.,anecdotes/miscellaneous,neutral
train,3294,3294::cat::0,We usually go to the Chart House to celebrate a birthday or anniversary.,anecdotes/miscellaneous,neutral
train,388,388::cat::0,this little place has a cute interior decor and affordable city prices.,ambience,positive
train,388,388::cat::1,this little place has a cute interior decor and affordable city prices.,price,positive
train,3070,3070::cat::0,You'll adore it.,anecdotes/miscellaneous,positive
train,3373,3373::cat::0,Two words: Free wine.,price,positive
train,425,425::cat::0,The price is reasonable although the service is poor.,service,negative
train,425,425::cat::1,The price is reasonable although the service is poor.,price,positive
train,3192,3192::cat::0,"The quantity is also very good, you will come out satisfied.",food,positive
train,1098,1098::cat::0,I have been to Roth's twice and both times were very disappointing.,anecdotes/miscellaneous,negative
train,2173,2173::cat::0,Worth visiting the 1st Ave spot because it is the original store.,anecdotes/miscellaneous,positive
train,391,391::cat::0,"I stumbled upon this second floor walk-up two Fridays ago when I was with two friends in town from L.A. Being serious sushi lovers, we sat at the sushi bar to be closer to the action.",anecdotes/miscellaneous,neutral
train,263,263::cat::0,"Raga's is a romantic, cozy restaurant.",ambience,positive
train,2384,2384::cat::0,The fried rice is amazing here.,food,positive
train,2962,2962::cat::0,"Three courses - choices include excellent mussels, puff pastry goat cheese and salad with a delicious dressing, and a hanger steak au poivre that is out of this world.",food,positive
train,3404,3404::cat::0,it's a perfect place to have a amanzing indian food.,food,positive
train,2599,2599::cat::0,The place is so cool and the service is prompt and curtious.,service,positive
train,2599,2599::cat::1,The place is so cool and the service is prompt and curtious.,ambience,positive
train,673,673::cat::0,At the end you're left with a mild broth with noodles that you can slurp out of a cup.,food,positive
train,648,648::cat::0,I just wonder how you can have such a delicious meal for such little money.,price,positive
train,648,648::cat::1,I just wonder how you can have such a delicious meal for such little money.,food,positive
train,863,863::cat::0,The food was delicious but do not come here on a empty stomach.,food,conflict
train,1623,1623::cat::0,The wine list is excellent.,food,positive
train,2177,2177::cat::0,so garantuan that you can't fit them in a toaster.,food,positive
train,430,430::cat::0,"Ive been to many Thai restaurants in Manhattan before, and Toons is by far the best Thai food Ive had (except for my mom's of course).",food,positive
train,1101,1101::cat::0,They wouldnt even let me finish my glass of wine before offering another.,service,positive
train,1823,1823::cat::0,I highly recommend the Sophia pizza.,anecdotes/miscellaneous,positive
train,324,324::cat::0,"Whem asked, we had to ask more detailed questions so that we knew what the specials were.",service,negative
train,2783,2783::cat::0,This is a consistently great place to dine for lunch or dinner.,anecdotes/miscellaneous,positive
train,2983,2983::cat::0,"Nice atmosphere, the service was very pleasant and the desert was good.",food,positive
train,2983,2983::cat::1,"Nice atmosphere, the service was very pleasant and the desert was good.",service,positive
train,2983,2983::cat::2,"Nice atmosphere, the service was very pleasant and the desert was good.",ambience,positive
train,66,66::cat::0,All the people that I bring there go back on their own and bring THEIR friends!,anecdotes/miscellaneous,positive
train,627,627::cat::0,After really enjoying ourselves at the bar we sat down at a table and had dinner.,anecdotes/miscellaneous,positive
train,3219,3219::cat::0,"Fabulous service, fantastic food, and a chilled out atmosphere and environment.",food,positive
train,3219,3219::cat::1,"Fabulous service, fantastic food, and a chilled out atmosphere and environment.",service,positive
train,3219,3219::cat::2,"Fabulous service, fantastic food, and a chilled out atmosphere and environment.",ambience,positive
train,2934,2934::cat::0,Not what I wanted to hear.,anecdotes/miscellaneous,negative
train,2787,2787::cat::0,Try the lasagnette appetizer.,food,positive
train,825,825::cat::0,"Pricey, but worth a try, at least once.",price,negative
train,825,825::cat::1,"Pricey, but worth a try, at least once.",anecdotes/miscellaneous,positive
train,197,197::cat::0,"I've been there a few times, and I usually end up sitting next to some pretty odd people.",anecdotes/miscellaneous,negative
train,604,604::cat::0,I liked the beer selection!,food,positive
train,2911,2911::cat::0,"Great food, good size menu, great service and an unpretensious setting.",food,positive
train,2911,2911::cat::1,"Great food, good size menu, great service and an unpretensious setting.",service,positive
train,2911,2911::cat::2,"Great food, good size menu, great service and an unpretensious setting.",ambience,positive
train,3074,3074::cat::0,Go here for a romantic dinner but not for an all out wow dining experience.,anecdotes/miscellaneous,conflict
train,1479,1479::cat::0,Can't wait to go back.,anecdotes/miscellaneous,positive
train,1074,1074::cat::0,I grew up eating Dosa and have yet to find a place in NY to satisfy my taste buds.,anecdotes/miscellaneous,neutral
train,912,912::cat::0,Wine list selection is good and wine-by-the-glass was generously filled to the top.,food,positive
train,728,728::cat::0,"With the great variety on the menu , I eat here often and never get bored .",food,positive
train,2925,2925::cat::0,The menu is very limited - i think we counted 4 or 5 entrees.,food,negative
train,495,495::cat::0,"If you are a carnivore, come hungry and you will leave more satisfied than you have ever been.",anecdotes/miscellaneous,positive
train,3436,3436::cat::0,The menu is limited but almost all of the dishes are excellent.,food,conflict
train,3273,3273::cat::0,Not too crazy about their sake martini.,food,negative
train,1215,1215::cat::0,"Great bagels, spreads and a good place to hang out in.",food,positive
train,1215,1215::cat::1,"Great bagels, spreads and a good place to hang out in.",anecdotes/miscellaneous,positive
train,183,183::cat::0,"The service varys from day to day- sometimes they're very nice, and sometimes not.",service,conflict
train,2511,2511::cat::0,"whoever the jazz duo was, they were on POINT.",ambience,positive
train,282,282::cat::0,One thing I liked about this place is that I never felt rushed or pressured to give up my table ot incoming guests.,service,positive
train,1562,1562::cat::0,This place is a great bargain.,price,positive
train,1712,1712::cat::0,We happened upon this place purely by accident and were pleased with the results.,anecdotes/miscellaneous,positive
train,3249,3249::cat::0,"Unfortunately, the food is outstanding, but everything else about this restaurant is the pits.",food,positive
train,3249,3249::cat::1,"Unfortunately, the food is outstanding, but everything else about this restaurant is the pits.",anecdotes/miscellaneous,negative
train,2052,2052::cat::0,Deff recimmend Bukhara they also have opened two new locations guess ill try them out.,anecdotes/miscellaneous,positive
train,3207,3207::cat::0,We always have a delicious meal and always leave feeling satisfied.,food,positive
train,672,672::cat::0,"Dip the ingredients in with your chopsticks, swirl them around, and eat.",food,neutral
train,2972,2972::cat::0,First went here to enjoy their garden terrace.,ambience,positive
train,1903,1903::cat::0,"My husbands was perfect, my was well done and dry.",food,conflict
train,2549,2549::cat::0,"Everyone I have spoken too there is super friendly, helpful, and willing to the extra mile for a customer.",service,positive
train,1755,1755::cat::0,The pizza was pretty good and huge.,food,positive
train,2890,2890::cat::0,Sapphire is the only Indian restaurant I go to when I'm in NYC.,anecdotes/miscellaneous,positive
train,2277,2277::cat::0,"The cuisine from what I've gathered is authentic Taiwanese, though its very different from what I've been accustomed to in Taipei.",food,neutral
train,2308,2308::cat::0,I heartily recommend.,anecdotes/miscellaneous,positive
train,51,51::cat::0,Heartland Brewery is by far one of the best places in NYC to make new friends and catch up with old ones.,anecdotes/miscellaneous,positive
train,3680,3680::cat::0,I almost hesititate to write a review because the atmosphere was so great and I would hate for it too become to crowded.,ambience,positive
train,3155,3155::cat::0,They are often crowded on the weekends but they are efficient and accurate with their service.,service,positive
train,3155,3155::cat::1,They are often crowded on the weekends but they are efficient and accurate with their service.,ambience,negative
train,1688,1688::cat::0,All my co-workers were amazed at how small the dish was.,food,negative
train,598,598::cat::0,"The atmosphere is unheralded, the service impecible, and the food magnificant.",food,positive
train,598,598::cat::1,"The atmosphere is unheralded, the service impecible, and the food magnificant.",service,positive
train,598,598::cat::2,"The atmosphere is unheralded, the service impecible, and the food magnificant.",ambience,positive
train,2926,2926::cat::0,"We ordered the special, grilled branzino, that was so infused with bone, it was difficult to eat.",food,negative
train,3083,3083::cat::0,"The wait staff is friendly, and the food has gotten better and better!",food,positive
train,3083,3083::cat::1,"The wait staff is friendly, and the food has gotten better and better!",service,positive
train,1388,1388::cat::0,"This place, which is only a few months old, is perhaps Queens' biggest secret!",anecdotes/miscellaneous,positive
train,2977,2977::cat::0,"It may be a bit packed on weekends, but the vibe is good and it is the best French food you will find in the area.",food,positive
train,2977,2977::cat::1,"It may be a bit packed on weekends, but the vibe is good and it is the best French food you will find in the area.",ambience,conflict
train,1574,1574::cat::0,This place is so much fun.,anecdotes/miscellaneous,positive
train,498,498::cat::0,I was glad I did.,anecdotes/miscellaneous,positive
train,2604,2604::cat::0,Right off the L in Brooklyn this is a nice cozy place with good pizza.,food,positive
train,2604,2604::cat::1,Right off the L in Brooklyn this is a nice cozy place with good pizza.,ambience,positive
train,473,473::cat::0,I've never been treated so rudely.,service,negative
train,380,380::cat::0,I'll be back soon.,anecdotes/miscellaneous,positive
train,2960,2960::cat::0,Le Pere Pinard has a $15 pre-theater menu that is outstanding.,food,positive
train,322,322::cat::0,Went inside and I started to get excited.,anecdotes/miscellaneous,positive
train,1383,1383::cat::0,I also ordered for delivery and the restaurant forgot half the order.,service,negative
train,892,892::cat::0,Our server checked on us maybe twice during the entire meal.,service,negative
train,2296,2296::cat::0,"However, it is jus too good to not praise it.",anecdotes/miscellaneous,positive
train,868,868::cat::0,We have been to Montparnasse many times and return often for good reason.,anecdotes/miscellaneous,positive
train,2936,2936::cat::0,The strong scents coming from the left and right of me negatively affected my taste buds.,anecdotes/miscellaneous,negative
train,3423,3423::cat::0,We had the lobster sandwich and it was FANTASTIC.,food,positive
train,154,154::cat::0,It's somewhere you can eat and be happy.,anecdotes/miscellaneous,positive
train,591,591::cat::0,"If you wrote a bad review, it's because you don't understand what Rao's is all about.",anecdotes/miscellaneous,positive
train,1197,1197::cat::0,"Had we been stalling I could understand where they were coming from, but we had been there less than an hour and they hadn't even brought us a check yet!",service,negative
train,2061,2061::cat::0,but overall i give it a 10,anecdotes/miscellaneous,positive
train,2274,2274::cat::0,"Though the Spider Roll may look like a challenge to eat, with soft shell crab hanging out of the roll, it is well worth the price you pay for them.",food,positive
train,2274,2274::cat::1,"Though the Spider Roll may look like a challenge to eat, with soft shell crab hanging out of the roll, it is well worth the price you pay for them.",price,positive
train,2804,2804::cat::0,Deep Fried Skewers are good and still rare to find in NYC.,food,positive
train,194,194::cat::0,"I have tried to make reservations, but both times, the hostess didn't have my name.",service,negative
train,148,148::cat::0,I also recommend the rice dishes or the different varieties of congee (rice porridge).,food,positive
train,2747,2747::cat::0,Their tuna tartar appetizer is to die for.,food,positive
train,2845,2845::cat::0,This was one of the BEST restaurants I've ever been to.,anecdotes/miscellaneous,positive
train,187,187::cat::0,This restaurant used to be pretty decent.,anecdotes/miscellaneous,negative
train,856,856::cat::0,"An oasis of refinement: Food, though somewhat uneven, often reaches the pinnacles of new American fine cuisine - chef's passion (and kitchen's precise execution) is most evident in the fish dishes and soups.",food,positive
train,2033,2033::cat::0,"If you love wine and cheese and delicious french fare, you'll love Artisanal!",food,positive
train,1402,1402::cat::0,I love Indian food and consider myself to be quite an expert on it.,food,positive
train,439,439::cat::0,Some baby pizzas get their wish.,food,neutral
train,3360,3360::cat::0,Plenty of choices to make your own creation.,food,positive
train,2949,2949::cat::0,It was tiny and I felt like I was eating in someone's living room.,ambience,negative
train,570,570::cat::0,I was there on sat.,anecdotes/miscellaneous,neutral
train,2053,2053::cat::0,Overall A oh ya even though there is waiting it is deff worth it,anecdotes/miscellaneous,positive
train,2053,2053::cat::1,Overall A oh ya even though there is waiting it is deff worth it,service,negative
train,3316,3316::cat::0,The lava cake dessert was incredible and I recommend it.,food,positive
train,433,433::cat::0,VT is what baby pizzas hope to be when they grow up.,anecdotes/miscellaneous,positive
train,738,738::cat::0,"From the terrible service, to the bland food, not to mention the unaccommodating managers, the overall experience was horrible.",food,negative
train,738,738::cat::1,"From the terrible service, to the bland food, not to mention the unaccommodating managers, the overall experience was horrible.",service,negative
train,1549,1549::cat::0,Lahore is a great place to duck into late-night when you need some really tasty food on the cheap -- you'll likely have trouble finishing the amount of food you get for FOUR DOLLARS.,food,positive
train,1549,1549::cat::1,Lahore is a great place to duck into late-night when you need some really tasty food on the cheap -- you'll likely have trouble finishing the amount of food you get for FOUR DOLLARS.,price,positive
train,1798,1798::cat::0,The last time I went we were seated at a table in a corridor next to the kitchen.,anecdotes/miscellaneous,negative
train,2941,2941::cat::0,good selection of wines ranging from affordable to high end.,food,positive
train,2941,2941::cat::1,good selection of wines ranging from affordable to high end.,price,conflict
train,362,362::cat::0,"Nice restaurant overall, with classic upscale Italian decor.",ambience,positive
train,2921,2921::cat::0,Not impressed with the food.,food,negative
train,1909,1909::cat::0,The entire dining experience was wonderful!,anecdotes/miscellaneous,positive
train,1878,1878::cat::0,The wine selection (by the glass and bottle) is wonderful and I always recommend that friends make a reservation if they're going to be in town.,food,positive
train,1878,1878::cat::1,The wine selection (by the glass and bottle) is wonderful and I always recommend that friends make a reservation if they're going to be in town.,anecdotes/miscellaneous,positive
train,858,858::cat::0,Service is highly refined: our seating was delayed 35 minutes past our reservation and the maitre d' apologized and regularly kept us apprised of progress.,service,positive
train,3376,3376::cat::0,"Order the panang duck, it's fantastic.",food,positive
train,173,173::cat::0,"Food is usually very good, though ocasionally I wondered about freshmess of raw vegatables in side orders.",food,conflict
train,1836,1836::cat::0,"Other than the crappy service from two individuals, it's great.",service,conflict
train,1703,1703::cat::0,What more can you ask for?,anecdotes/miscellaneous,positive
train,3564,3564::cat::0,Wondering who had the best deals we noticed a line had formed to wait for this one particular establishment.,anecdotes/miscellaneous,neutral
train,1404,1404::cat::0,They have authentic Indian at amazin prices.,food,positive
train,1404,1404::cat::1,They have authentic Indian at amazin prices.,price,positive
train,645,645::cat::0,You are treated just like royality.,service,positive
train,3288,3288::cat::0,"There's nice and quiet, small but enough for 6 (or more).",ambience,conflict
train,1819,1819::cat::0,Ambiance- relaxed and stylish.,ambience,positive
train,1144,1144::cat::0,I've never felt more unwelcome than last month at Jimmy's Bronx Cafe.,anecdotes/miscellaneous,negative
train,2639,2639::cat::0,"Luckily we saved room for the BBQ Salmon, Sea Bass and Crispy Duck.",food,positive
train,1474,1474::cat::0,"Yes, they use fancy ingredients, but even fancy ingredients don't make for good pizza unless someone knows how to get the crust right.",food,negative
train,1553,1553::cat::0,"Looking from the outside in, one would hesitate to enter this hole in the wall (really, that's what it is).",ambience,negative
train,2059,2059::cat::0,and yes Dal Bukhara is so dam good and so are all the kababs.,food,positive
train,926,926::cat::0,I look forward to eating here again,anecdotes/miscellaneous,positive
train,2385,2385::cat::0,I've been coming here as a child and always come back for the taste.,food,positive
train,2498,2498::cat::0,Tuk Tuk is one of those comfortable neighborhood joints where you know you will always have a good meal at a fair price.,food,positive
train,2498,2498::cat::1,Tuk Tuk is one of those comfortable neighborhood joints where you know you will always have a good meal at a fair price.,ambience,positive
train,2498,2498::cat::2,Tuk Tuk is one of those comfortable neighborhood joints where you know you will always have a good meal at a fair price.,price,positive
train,2469,2469::cat::0,"A glass of Leaping Lizard, a glass of prosecco, and the mussels had everything happy.",food,positive
train,567,567::cat::0,"Food was average and creme brulee was awful - the sugar was charred, not caramelized and smelled of kerosene.",food,negative
train,3517,3517::cat::0,The food always tastes fresh and served promptly.,food,positive
train,3517,3517::cat::1,The food always tastes fresh and served promptly.,service,positive
train,2069,2069::cat::0,I know because I live nearby.,anecdotes/miscellaneous,neutral
train,1599,1599::cat::0,The pizza here is delicious.,food,positive
train,2860,2860::cat::0,My entire family was horrified.,anecdotes/miscellaneous,negative
train,1092,1092::cat::0,On a monthly basis my friends and I get together and have a girls night out.,anecdotes/miscellaneous,neutral
train,2548,2548::cat::0,"Pizza and garlic knots are great as well, I order from them quite often and the delivery is always super quick!",food,positive
train,2548,2548::cat::1,"Pizza and garlic knots are great as well, I order from them quite often and the delivery is always super quick!",service,positive
